{
  "schema_version": "1.1",
  "source_batch": {
    "batch_id": "batch_cspm_20260221_001",
    "source_system": "AcmeCSPM",
    "connector_version": "0.3.0",
    "received_at": "2026-02-21T10:30:00-06:00",
    "trust_label": "trusted_external_registered"
  },
  "findings": [
    {
      "schema_version": "1.1",
      "finding_id": "find_cspm_001",
      "source": {
        "tool_name": "AcmeCSPM",
        "tool_type": "cspm",
        "connector_id": "conn_acme_cspm_01",
        "trust_label": "trusted_external_registered",
        "raw_record_ref": "raw://acmecspm/alerts/12345"
      },
      "project_id": "proj_customer_support_ai",
      "environment": "preprod",
      "category": "security",
      "severity": "high",
      "confidence": "high",
      "title": "Undeclared outbound egress rule on API service",
      "description": "Security group allows outbound egress to public internet not declared in PeaRL network policy.",
      "affected_components": [
        "api-service"
      ],
      "control_refs": [
        "network.outbound_allowlist"
      ],
      "exploitability": "medium",
      "detected_at": "2026-02-21T10:30:00-06:00",
      "normalized": false,
      "traceability": {
        "trace_id": "trc_ingest_001",
        "source_refs": [
          "AcmeCSPM:12345"
        ]
      }
    }
  ],
  "options": {
    "normalize_on_ingest": true,
    "strict_validation": true,
    "quarantine_on_error": true
  }
}
